{
  "schema_version": "1.0",
  "profile_id": "master-cv-1",
  "created_at": "2026-05-13T12:00:00Z",
  "claims": [
    {
      "claim_id": "claim-1",
      "category": "skill",
      "statement": "Experienced with Python backend services.",
      "start_date": "2020",
      "organization": "Example Org",
      "role": "Backend Engineer",
      "tags": ["python", "backend"],
      "approved_for_tailoring": true,
      "provenance": {
        "source_type": "verified_document",
        "confidence": 0.95,
        "needs_review": false,
        "source_refs": ["cv.pdf"]
      }
    }
  ],
  "preferred_cv_sections": ["experience", "skills"],
  "template_refs": ["default"]
}

